{
  "derived_artifacts": [
    {
      "generator": "scripts/build_migration_story_ir.py",
      "ref": "fixtures/migration/story-ir/country-reference.csv",
      "sha256": "16e73fbadb90585743fcd45e1062e1dcb8618f5898a2030bf097fb5c04101dea",
      "source_ids": [
        "migration-model-flows",
        "natural-earth-countries"
      ]
    },
    {
      "generator": "scripts/build_migration_story_ir.py",
      "ref": "fixtures/migration/story-ir/yearly-top30-summary.csv",
      "sha256": "c608088f3325f118cbf684ea1365daa0247a5c69bccfe29db8574683dd433559",
      "source_ids": [
        "migration-model-flows"
      ]
    },
    {
      "generator": "scripts/build_migration_story_ir.py",
      "ref": "fixtures/migration/story-ir/continent-flows-top30.csv",
      "sha256": "6a365878c4b2a731fe572e0b1e033f2e50707e64a99f0bcb6fefb88268f7a61f",
      "source_ids": [
        "migration-model-flows",
        "natural-earth-countries"
      ]
    },
    {
      "generator": "scripts/build_migration_story_ir.py",
      "ref": "fixtures/migration/story-ir/route-coordinates.csv",
      "sha256": "92a81bf712dfb182344d2f1882abcb10445bb62ff866d0a19a18d792d9a8a525",
      "source_ids": [
        "migration-model-flows",
        "natural-earth-countries"
      ]
    }
  ],
  "ledger_id": "migration-four-decades",
  "schema_version": "0.1.0",
  "semantic_guards": [
    "Every flow value is a neural-network model estimate, not an observed journey.",
    "The fixture contains the 30 largest estimated corridors in each selected year; sums and shares are selection-bounded and are not global totals.",
    "Migrant stock and stock change are absent and must not be relabelled as migration flow.",
    "Map endpoints use Natural Earth label points and arcs encode abstract origin-destination relationships, not physical routes."
  ],
  "sources": [
    {
      "id": "migration-model-flows",
      "license": "GPL-3.0",
      "local_ref": "fixtures/migration/deep-learning-human-migration-top-corridors.csv",
      "retrieved_at": "2026-09-19T14:50:57Z",
      "role": "primary_data",
      "sha256": "156b218170d022e5c87770b1be8c3d6faa989d17228deff4f017103dce871ea4",
      "title": "Deep-learning model estimates of annual bilateral migration flows",
      "url": "https://doi.org/10.57967/hf/8902"
    },
    {
      "id": "natural-earth-countries",
      "license": "Public domain",
      "local_ref": "external/ne_50m_admin_0_countries.geojson",
      "retrieved_at": "2026-09-20T00:30:00Z",
      "role": "geography",
      "sha256": "3e458fc036ad0a66411f2c1e6cac49c5d7bfb81cb1123bc513b22511a2b7fdeb",
      "title": "Natural Earth 1:50m Admin 0 countries",
      "url": "https://raw.githubusercontent.com/nvkelso/natural-earth-vector/ca96624a56bd078437bca8184e78163e5039ad19/geojson/ne_50m_admin_0_countries.geojson"
    }
  ]
}
